{
  "schema_version": 4,
  "contract_id": "nightstream-superneo-v1",
  "contract_hash": "6dd218a97b507d346e839ccd57c5747669e91289e380a76b56da3e211461b966",
  "profile_id": "nightstream-superneo-fprime-v1",
  "profile_hash": "8d8299cbd286fc12052c4d3cb16112ce96b7fc64f417fe0e97cc822eb5df2e2e",
  "status": "specified",
  "states": [
    {
      "id": "ST-START",
      "terminal": false,
      "description": "No statement or proof byte is accepted."
    },
    {
      "id": "ST-DECODED",
      "terminal": false,
      "description": "The statement and proof containers are canonically decoded."
    },
    {
      "id": "ST-PROFILE-BOUND",
      "terminal": false,
      "description": "The verifier-owned structure, profile, and verifier key are bound."
    },
    {
      "id": "ST-PICCS-INPUT",
      "terminal": false,
      "description": "The ordered PiCCS source instances and prover input are transcript-bound."
    },
    {
      "id": "ST-PICCS-COINS",
      "terminal": false,
      "description": "The 28 alpha coordinates and gamma are sampled from the bound PiCCS prefix."
    },
    {
      "id": "ST-PICCS-SUMCHECK",
      "terminal": false,
      "description": "All 28 joint PiCCS SumCheck rounds are accepted."
    },
    {
      "id": "ST-PICCS-OUTPUT",
      "terminal": false,
      "description": "The 17-by-14 ordered ring-output family is transcript-bound."
    },
    {
      "id": "ST-PICCS-ACCEPTED",
      "terminal": false,
      "description": "The joint terminal equation and padded-identity norm binding are accepted."
    },
    {
      "id": "ST-PIRLC-SAMPLING",
      "terminal": false,
      "description": "All bounded strong-set sampler counters are active after PiCCS acceptance."
    },
    {
      "id": "ST-PIRLC-ACCEPTED",
      "terminal": false,
      "description": "The PiRLC equations and global norm guard are accepted."
    },
    {
      "id": "ST-PIDEC-ACCEPTED",
      "terminal": false,
      "description": "The 16 child instances and all recomposition equations are accepted."
    },
    {
      "id": "ST-FOLD-ACCEPTED",
      "terminal": true,
      "description": "One normative fold result and its final fold transcript digest are accepted."
    },
    {
      "id": "ST-REJECT",
      "terminal": true,
      "description": "A fail-closed check rejected the proof."
    }
  ],
  "challenges": [
    {
      "id": "CH-PICCS-ALPHA",
      "role": "Twenty-eight equality-selector coordinates for the joint row cube",
      "sample_space": "K_ext^28",
      "sampled_in_event": "EV-PICCS-COINS",
      "transcript_tag": "piccs_alpha",
      "decoder": "56 consecutive base-field lanes, paired as (c0,c1) in coordinate order",
      "after_events": [
        "EV-PICCS-ABSORB"
      ],
      "status": "specified",
      "blocked_by": [
        "NSD-TRANSCRIPT-001"
      ],
      "unresolved_blocker_ids": [],
      "rule_ids": [
        "NS-PICCS-COINS",
        "NS-CHALLENGE-EXTENSION"
      ]
    },
    {
      "id": "CH-PICCS-GAMMA",
      "role": "Absolute disjoint-block mixing challenge",
      "sample_space": "K_ext",
      "sampled_in_event": "EV-PICCS-COINS",
      "transcript_tag": "piccs_gamma",
      "decoder": "two consecutive base-field lanes interpreted as (c0,c1)",
      "after_events": [
        "EV-PICCS-ABSORB"
      ],
      "status": "specified",
      "blocked_by": [
        "NSD-TRANSCRIPT-001"
      ],
      "unresolved_blocker_ids": [],
      "rule_ids": [
        "SN-PICCS-TARGET",
        "NS-PICCS-COINS",
        "NS-CHALLENGE-EXTENSION"
      ]
    },
    {
      "id": "CH-SUMCHECK-ROUND",
      "role": "One verifier challenge after each accepted joint SumCheck round message",
      "sample_space": "K_ext",
      "sampled_in_event": "EV-PICCS-SUMCHECK",
      "transcript_tag": "sumcheck_round",
      "decoder": "two consecutive base-field lanes interpreted as (c0,c1)",
      "after_events": [
        "EV-PICCS-COINS"
      ],
      "status": "specified",
      "blocked_by": [
        "NSD-TRANSCRIPT-001"
      ],
      "unresolved_blocker_ids": [],
      "rule_ids": [
        "SN-SUMCHECK-ROUNDS",
        "NS-PICCS-SUMCHECK",
        "NS-CHALLENGE-EXTENSION"
      ]
    },
    {
      "id": "CH-PIRLC-CANDIDATE",
      "role": "One indexed base-field candidate for a bounded strong-set coefficient",
      "sample_space": "F_q",
      "sampled_in_event": "EV-PIRLC-SAMPLE",
      "transcript_tag": "pirlc_candidate",
      "decoder": "one canonical base-field squeeze lane",
      "after_events": [
        "EV-PIRLC-START"
      ],
      "status": "specified",
      "blocked_by": [
        "NSD-SAMPLER-001",
        "NSD-TRANSCRIPT-001"
      ],
      "unresolved_blocker_ids": [],
      "rule_ids": [
        "NS-SAMPLER-CANDIDATES",
        "NS-SAMPLER-REPETITIONS"
      ]
    }
  ],
  "events": [
    {
      "id": "EV-DECODE",
      "phase": "decode",
      "from_state": "ST-START",
      "to_state": "ST-DECODED",
      "authority": "verifier",
      "rule_ids": [
        "NS-ENC-BASE",
        "NS-ENC-EXTENSION",
        "NS-ENC-RING",
        "NS-ENC-CONTAINER",
        "NS-SECURITY-POLICY"
      ],
      "challenge_ids": [],
      "status": "specified",
      "blocked_by": [
        "NSD-ENCODING-001",
        "NSD-SECURITY-001",
        "NSD-THREAT-MODEL-001"
      ],
      "unresolved_blocker_ids": [],
      "inputs": [
        "statement-bytes",
        "proof-bytes"
      ],
      "outputs": [
        "typed-statement",
        "typed-proof"
      ],
      "reject_conditions": [
        "REJECT-NONCANONICAL",
        "REJECT-UNKNOWN-SECTION",
        "REJECT-DUPLICATE-SECTION",
        "REJECT-SECTION-ORDER",
        "REJECT-LENGTH",
        "REJECT-TRAILING-BYTES",
        "REJECT-FOLD-LIMIT"
      ]
    },
    {
      "id": "EV-BIND-PROFILE",
      "phase": "profile",
      "from_state": "ST-DECODED",
      "to_state": "ST-PROFILE-BOUND",
      "authority": "verifier",
      "rule_ids": [
        "NS-ALGEBRA-PROFILE",
        "NS-SHAPE-LOGICAL",
        "NS-SHAPE-PADDING",
        "NS-SHAPE-IDENTITY",
        "NS-SHAPE-POLYNOMIAL",
        "NS-AUTH-STRUCTURE",
        "NS-ENC-STRUCTURE",
        "NS-ENC-COMMITMENT",
        "NS-VERIFIER-KEY-DIGEST"
      ],
      "challenge_ids": [],
      "status": "specified",
      "blocked_by": [
        "NSD-AUTHORITY-001",
        "NSD-DOMAIN-MAP-001",
        "NSD-ENCODING-001",
        "NSD-HASH-001",
        "NSD-TRANSCRIPT-001"
      ],
      "unresolved_blocker_ids": [],
      "inputs": [
        "typed-statement",
        "typed-proof",
        "verifier-key"
      ],
      "outputs": [
        "selected-structure",
        "selected-profile",
        "recomputed-verifier-key-digest"
      ],
      "reject_conditions": [
        "REJECT-PROFILE-ID",
        "REJECT-STRUCTURE",
        "REJECT-SHAPE",
        "REJECT-PADDING"
      ]
    },
    {
      "id": "EV-PICCS-ABSORB",
      "phase": "piccs-input",
      "from_state": "ST-PROFILE-BOUND",
      "to_state": "ST-PICCS-INPUT",
      "authority": "verifier",
      "rule_ids": [
        "NS-PUBLIC-CARRIER",
        "NS-AUTH-CLAIM",
        "NS-PICCS-VARIANT",
        "NS-TRANSCRIPT-ORDER"
      ],
      "challenge_ids": [],
      "status": "specified",
      "blocked_by": [
        "NSD-AUTHORITY-001",
        "NSD-CARRIER-001",
        "NSD-PICCS-001",
        "NSD-TRANSCRIPT-001"
      ],
      "unresolved_blocker_ids": [],
      "inputs": [
        "session-frame",
        "verifier-key-frame",
        "canonical-statement-frame-with-ordered-source-instances",
        "empty-piccs-input-frame"
      ],
      "outputs": [
        "bound-piccs-prefix"
      ],
      "reject_conditions": [
        "REJECT-CLAIM-AUTHORITY",
        "REJECT-SOURCE-COUNT",
        "REJECT-FRESH-PUBLIC-PADDING",
        "REJECT-PICCS-SHAPE"
      ]
    },
    {
      "id": "EV-PICCS-COINS",
      "phase": "piccs-challenges",
      "from_state": "ST-PICCS-INPUT",
      "to_state": "ST-PICCS-COINS",
      "authority": "verifier",
      "rule_ids": [
        "NS-PICCS-COINS",
        "NS-TRANSCRIPT-FRAMING",
        "NS-CHALLENGE-EXTENSION"
      ],
      "challenge_ids": [
        "CH-PICCS-ALPHA",
        "CH-PICCS-GAMMA"
      ],
      "status": "specified",
      "blocked_by": [
        "NSD-BATCH-COINS-001",
        "NSD-TRANSCRIPT-001"
      ],
      "unresolved_blocker_ids": [],
      "inputs": [
        "bound-piccs-prefix"
      ],
      "outputs": [
        "alpha-28",
        "gamma"
      ],
      "reject_conditions": [
        "REJECT-TRANSCRIPT-STATE",
        "REJECT-CHALLENGE-COUNT"
      ]
    },
    {
      "id": "EV-PICCS-SUMCHECK",
      "phase": "piccs-sumcheck",
      "from_state": "ST-PICCS-COINS",
      "to_state": "ST-PICCS-SUMCHECK",
      "authority": "verifier",
      "rule_ids": [
        "SN-SUMCHECK-ROUNDS",
        "NS-PICCS-SUMCHECK",
        "NS-TRANSCRIPT-ORDER"
      ],
      "challenge_ids": [
        "CH-SUMCHECK-ROUND"
      ],
      "status": "specified",
      "blocked_by": [
        "NSD-PICCS-001",
        "NSD-TRANSCRIPT-001"
      ],
      "unresolved_blocker_ids": [],
      "inputs": [
        "alpha-28",
        "gamma",
        "28-ordered-round-polynomials"
      ],
      "outputs": [
        "28-round-challenges",
        "sumcheck-terminal-claim"
      ],
      "reject_conditions": [
        "REJECT-ROUND-COUNT",
        "REJECT-ROUND-DEGREE",
        "REJECT-ROUND-RECURRENCE",
        "REJECT-ROUND-ENCODING"
      ],
      "note": "For round j, absorb j and the ten ordered extension coefficients, check the SumCheck recurrence, and only then squeeze challenge j. Repeat for j=0 through 27."
    },
    {
      "id": "EV-PICCS-OUTPUT",
      "phase": "piccs-output",
      "from_state": "ST-PICCS-SUMCHECK",
      "to_state": "ST-PICCS-OUTPUT",
      "authority": "verifier",
      "rule_ids": [
        "NS-PICCS-TERMINAL",
        "NS-TRANSCRIPT-ORDER"
      ],
      "challenge_ids": [],
      "status": "specified",
      "blocked_by": [